[
  {
    "eventId": "9f3a9d30-3f58-4f9f-8fe8-29a4b2f41001",
    "ts": 1772158200000,
    "topicId": "topic-neural-symbolic-discovery",
    "runId": "run-20260227-001",
    "agentId": "review",
    "kind": "event_emitted",
    "severity": "info",
    "summary": "run started",
    "payload": {
      "trigger": "manual"
    },
    "traceId": "trace-run-20260227-001"
  },
  {
    "eventId": "9f3a9d30-3f58-4f9f-8fe8-29a4b2f41002",
    "ts": 1772158202000,
    "topicId": "topic-neural-symbolic-discovery",
    "runId": "run-20260227-001",
    "agentId": "review",
    "kind": "module_started",
    "severity": "info",
    "summary": "review module started",
    "payload": {
      "runId": "run-20260227-001",
      "topicId": "topic-neural-symbolic-discovery",
      "module": "review",
      "model": "deepseek-chat",
      "thinkingMode": "deep",
      "online": true
    },
    "traceId": "trace-run-20260227-001"
  },
  {
    "eventId": "9f3a9d30-3f58-4f9f-8fe8-29a4b2f41003",
    "ts": 1772158205000,
    "topicId": "topic-neural-symbolic-discovery",
    "runId": "run-20260227-001",
    "agentId": "review",
    "kind": "agent_status_updated",
    "severity": "info",
    "summary": "review running",
    "payload": {
      "status": "running",
      "progress": 0.2
    },
    "traceId": "trace-run-20260227-001"
  },
  {
    "eventId": "9f3a9d30-3f58-4f9f-8fe8-29a4b2f41004",
    "ts": 1772158215000,
    "topicId": "topic-neural-symbolic-discovery",
    "runId": "run-20260227-001",
    "agentId": "review",
    "kind": "artifact_created",
    "severity": "info",
    "summary": "review produced survey.md",
    "payload": {
      "stage": "review_to_ideation",
      "handoffTo": "ideation"
    },
    "artifacts": [
      {
        "artifactId": "art-survey-001",
        "name": "survey.md",
        "uri": "/api/topics/topic-neural-symbolic-discovery/artifacts/survey.md",
        "contentType": "text/markdown"
      }
    ],
    "traceId": "trace-run-20260227-001"
  },
  {
    "eventId": "9f3a9d30-3f58-4f9f-8fe8-29a4b2f41005",
    "ts": 1772158219000,
    "topicId": "topic-neural-symbolic-discovery",
    "runId": "run-20260227-001",
    "agentId": "review",
    "kind": "module_finished",
    "severity": "info",
    "summary": "review module finished",
    "payload": {
      "runId": "run-20260227-001",
      "module": "review",
      "status": "success",
      "artifactNames": [
        "survey.md"
      ],
      "metrics": {
        "papersAnalyzed": 23
      }
    },
    "traceId": "trace-run-20260227-001"
  },
  {
    "eventId": "9f3a9d30-3f58-4f9f-8fe8-29a4b2f41006",
    "ts": 1772158221000,
    "topicId": "topic-neural-symbolic-discovery",
    "runId": "run-20260227-001",
    "agentId": "ideation",
    "kind": "module_started",
    "severity": "info",
    "summary": "ideation module started",
    "payload": {
      "runId": "run-20260227-001",
      "topicId": "topic-neural-symbolic-discovery",
      "module": "ideation",
      "model": "deepseek-chat",
      "thinkingMode": "deep",
      "online": true
    },
    "traceId": "trace-run-20260227-001"
  },
  {
    "eventId": "9f3a9d30-3f58-4f9f-8fe8-29a4b2f41007",
    "ts": 1772158227000,
    "topicId": "topic-neural-symbolic-discovery",
    "runId": "run-20260227-001",
    "agentId": "ideation",
    "kind": "artifact_created",
    "severity": "info",
    "summary": "ideation produced ideas.md",
    "payload": {
      "stage": "ideation_to_experiment",
      "handoffTo": "experiment"
    },
    "artifacts": [
      {
        "artifactId": "art-ideas-001",
        "name": "ideas.md",
        "uri": "/api/topics/topic-neural-symbolic-discovery/artifacts/ideas.md",
        "contentType": "text/markdown"
      }
    ],
    "traceId": "trace-run-20260227-001"
  },
  {
    "eventId": "9f3a9d30-3f58-4f9f-8fe8-29a4b2f41008",
    "ts": 1772158231000,
    "topicId": "topic-neural-symbolic-discovery",
    "runId": "run-20260227-001",
    "agentId": "ideation",
    "kind": "module_finished",
    "severity": "info",
    "summary": "ideation module finished",
    "payload": {
      "runId": "run-20260227-001",
      "module": "ideation",
      "status": "success",
      "artifactNames": [
        "ideas.md"
      ]
    },
    "traceId": "trace-run-20260227-001"
  },
  {
    "eventId": "9f3a9d30-3f58-4f9f-8fe8-29a4b2f41009",
    "ts": 1772158234000,
    "topicId": "topic-neural-symbolic-discovery",
    "runId": "run-20260227-001",
    "agentId": "experiment",
    "kind": "module_started",
    "severity": "info",
    "summary": "experiment module started",
    "payload": {
      "runId": "run-20260227-001",
      "topicId": "topic-neural-symbolic-discovery",
      "module": "experiment",
      "model": "deepseek-chat",
      "thinkingMode": "deep",
      "online": true
    },
    "traceId": "trace-run-20260227-001"
  },
  {
    "eventId": "9f3a9d30-3f58-4f9f-8fe8-29a4b2f4100a",
    "ts": 1772158239000,
    "topicId": "topic-neural-symbolic-discovery",
    "runId": "run-20260227-001",
    "agentId": "experiment",
    "kind": "module_failed",
    "severity": "error",
    "summary": "experiment module failed on first attempt",
    "payload": {
      "runId": "run-20260227-001",
      "module": "experiment",
      "error": {
        "message": "GPU memory exceeded during simulation",
        "code": "OOM_SIM"
      },
      "retryable": true
    },
    "traceId": "trace-run-20260227-001"
  },
  {
    "eventId": "9f3a9d30-3f58-4f9f-8fe8-29a4b2f4100b",
    "ts": 1772158242000,
    "topicId": "topic-neural-symbolic-discovery",
    "runId": "run-20260227-001",
    "agentId": "experiment",
    "kind": "approval_required",
    "severity": "warn",
    "summary": "human approval required before re-running expensive experiment",
    "payload": {
      "runId": "run-20260227-001",
      "module": "experiment",
      "summary": "Estimated compute cost exceeds configured budget.",
      "draftArtifact": {
        "name": "result_draft.md",
        "mimeType": "text/markdown",
        "sizeBytes": 2198
      }
    },
    "traceId": "trace-run-20260227-001"
  },
  {
    "eventId": "9f3a9d30-3f58-4f9f-8fe8-29a4b2f4100c",
    "ts": 1772158247000,
    "topicId": "topic-neural-symbolic-discovery",
    "runId": "run-20260227-001",
    "agentId": "experiment",
    "kind": "approval_resolved",
    "severity": "info",
    "summary": "approval resolved by admin",
    "payload": {
      "runId": "run-20260227-001",
      "module": "experiment",
      "approved": true,
      "note": "Proceed with one retry only."
    },
    "traceId": "trace-run-20260227-001"
  },
  {
    "eventId": "9f3a9d30-3f58-4f9f-8fe8-29a4b2f4100d",
    "ts": 1772158253000,
    "topicId": "topic-neural-symbolic-discovery",
    "runId": "run-20260227-001",
    "agentId": "experiment",
    "kind": "artifact_created",
    "severity": "info",
    "summary": "experiment produced results.json",
    "payload": {
      "stage": "experiment_to_ideation_feedback",
      "handoffTo": "ideation"
    },
    "artifacts": [
      {
        "artifactId": "art-results-001",
        "name": "results.json",
        "uri": "/api/topics/topic-neural-symbolic-discovery/artifacts/results.json",
        "contentType": "application/json"
      }
    ],
    "traceId": "trace-run-20260227-001"
  },
  {
    "eventId": "9f3a9d30-3f58-4f9f-8fe8-29a4b2f4100e",
    "ts": 1772158258000,
    "topicId": "topic-neural-symbolic-discovery",
    "runId": "run-20260227-001",
    "agentId": "experiment",
    "kind": "module_finished",
    "severity": "info",
    "summary": "experiment module finished",
    "payload": {
      "runId": "run-20260227-001",
      "module": "experiment",
      "status": "success",
      "artifactNames": [
        "results.json",
        "result.md"
      ],
      "metrics": {
        "f1": 0.73,
        "latencyMs": 184
      }
    },
    "traceId": "trace-run-20260227-001"
  },
  {
    "eventId": "9f3a9d30-3f58-4f9f-8fe8-29a4b2f4100f",
    "ts": 1772158263000,
    "topicId": "topic-neural-symbolic-discovery",
    "runId": "run-20260227-002",
    "agentId": "review",
    "kind": "module_skipped",
    "severity": "warn",
    "summary": "review module skipped by configuration",
    "payload": {
      "runId": "run-20260227-002",
      "module": "review",
      "reason": "disabled_in_config"
    },
    "traceId": "trace-run-20260227-002"
  },
  {
    "eventId": "9f3a9d30-3f58-4f9f-8fe8-29a4b2f41010",
    "ts": 1772158270000,
    "topicId": "admin-overview",
    "runId": "admin-0001",
    "agentId": "review",
    "kind": "admin_metrics",
    "severity": "info",
    "summary": "admin metrics snapshot",
    "payload": {
      "ts": 1772158270000,
      "activeRuns": 3,
      "runsLast5m": 7,
      "eventsLast5m": 214,
      "moduleInFlight": {
        "review": 1,
        "ideation": 1,
        "experiment": 1
      },
      "approvalsPending": 2,
      "errorRateLast5m": 0.08
    },
    "traceId": "trace-admin-0001"
  }
]
